{
  "schema_version": 1,
  "evidence_id": "E-S45-per-tenant-production-key-management-20260818",
  "recorded_at": "2026-08-18T05:34:00Z",
  "issue_ref": "https://github.com/nelsonbridge/project-enki/issues/137",
  "architecture_lock_ref": "releases/enki-hosted-1.0-rc2/architecture-lock.json",
  "control_id": "per-tenant-production-key-management",
  "validation_scope": {
    "classification": "production-equivalent-hosted-free-tier",
    "external_services_budget_usd": 0,
    "uses_real_customer_data": false,
    "allows_secret_plaintext_in_artifacts": false
  },
  "cost_attestation": {
    "currency": "USD",
    "total_observed_cost_usd": 0,
    "provider_checks": [
      {
        "provider": "Cloudflare",
        "service": "Workers",
        "plan_tier": "free-tier",
        "observed_cost_usd": 0,
        "evidence_location": "raw-evidence/sprint45/billing/preflight-zero-cost-declaration.log"
      },
      {
        "provider": "Neon",
        "service": "Postgres",
        "plan_tier": "free-tier",
        "observed_cost_usd": 0,
        "evidence_location": "raw-evidence/sprint45/billing/preflight-zero-cost-declaration.log"
      }
    ]
  },
  "run": {
    "run_date": "2026-08-18",
    "reproduction_steps": [
      "Verify per-tenant key custody, rotation, and revocation checks are explicit.",
      "Document hosted key lifecycle prerequisites for independent execution.",
      "Capture immutable rehearsal log and hash."
    ],
    "toolchain": [
      "PowerShell Get-FileHash",
      "Repository-local governance rehearsal"
    ]
  },
  "participants": {
    "implementer": "@copilot-cli",
    "independent_reviewer": "PENDING-INDEPENDENT-REVIEWER"
  },
  "artifacts": [
    {
      "kind": "manual-test-log",
      "location": "raw-evidence/sprint45/key-management-rehearsal.log",
      "sha256": "sha256:01969d0b914390dc8a9482a83e6fac4ce3f575b1127912930610ab96886797b0"
    }
  ],
  "result": {
    "status": "PARTIAL",
    "reviewed_at": "2026-08-18T05:34:00Z",
    "summary": "Hosted tenant-scoped key lifecycle rehearsal remains blocked pending external key-management authority."
  },
  "remediation": {
    "required": true,
    "owner": "HUMAN-KEY-OWNER",
    "due_date": "2026-08-25",
    "tracking_ref": "Issue-137/key-lifecycle-hosted-rehearsal"
  }
}
