{
  "schema_version": 1,
  "evidence_id": "E-S45-managed-database-row-level-isolation-20260818",
  "recorded_at": "2026-08-18T05:34:00Z",
  "issue_ref": "https://github.com/nelsonbridge/project-enki/issues/137",
  "architecture_lock_ref": "releases/enki-hosted-1.0-rc2/architecture-lock.json",
  "control_id": "managed-database-row-level-isolation",
  "validation_scope": {
    "classification": "production-equivalent-hosted-free-tier",
    "external_services_budget_usd": 0,
    "uses_real_customer_data": false,
    "allows_secret_plaintext_in_artifacts": false
  },
  "cost_attestation": {
    "currency": "USD",
    "total_observed_cost_usd": 0,
    "provider_checks": [
      {
        "provider": "Neon",
        "service": "Postgres",
        "plan_tier": "free-tier",
        "observed_cost_usd": 0,
        "evidence_location": "raw-evidence/sprint45/billing/preflight-zero-cost-declaration.log"
      }
    ]
  },
  "run": {
    "run_date": "2026-08-18",
    "reproduction_steps": [
      "Verify row-level isolation and cross-tenant denial checks are specified.",
      "Document hosted RLS environment requirements for execution.",
      "Capture immutable rehearsal log and hash."
    ],
    "toolchain": [
      "PowerShell Get-FileHash",
      "Repository-local governance rehearsal"
    ]
  },
  "participants": {
    "implementer": "@copilot-cli",
    "independent_reviewer": "PENDING-INDEPENDENT-REVIEWER"
  },
  "artifacts": [
    {
      "kind": "manual-test-log",
      "location": "raw-evidence/sprint45/tenant-isolation-rehearsal.log",
      "sha256": "sha256:cbd98a54694dff4f14ca759ac0f6afd3ff23284cbf70a0ccdb62b84f0ed419c6"
    }
  ],
  "result": {
    "status": "PARTIAL",
    "reviewed_at": "2026-08-18T05:34:00Z",
    "summary": "Hosted multi-tenant RLS execution remains pending managed database access and independent reviewer execution."
  },
  "remediation": {
    "required": true,
    "owner": "HUMAN-DATABASE-OWNER",
    "due_date": "2026-08-25",
    "tracking_ref": "Issue-137/tenant-isolation-hosted-rehearsal"
  }
}
