{
  "schema_version": 1,
  "evidence_id": "E-S45-CLOUD-IAM-YYYYMMDD-001",
  "recorded_at": "2026-08-18T00:00:00Z",
  "issue_ref": "https://github.com/nelsonbridge/project-enki/issues/137",
  "architecture_lock_ref": "releases/enki-hosted-1.0-rc2/architecture-lock.json",
  "control_id": "cloud-iam",
  "validation_scope": {
    "classification": "production-equivalent-hosted-free-tier",
    "external_services_budget_usd": 0,
    "uses_real_customer_data": false,
    "allows_secret_plaintext_in_artifacts": false
  },
  "cost_attestation": {
    "currency": "USD",
    "total_observed_cost_usd": 0,
    "provider_checks": [
      {
        "provider": "Cloudflare",
        "service": "Workers",
        "plan_tier": "free-tier",
        "observed_cost_usd": 0,
        "evidence_location": "raw-evidence/sprint45/billing/cloudflare-workers-cost-check.txt"
      },
      {
        "provider": "Neon",
        "service": "Postgres",
        "plan_tier": "free-tier",
        "observed_cost_usd": 0,
        "evidence_location": "raw-evidence/sprint45/billing/neon-postgres-cost-check.txt"
      },
      {
        "provider": "Cloudflare",
        "service": "R2",
        "plan_tier": "free-tier",
        "observed_cost_usd": 0,
        "evidence_location": "raw-evidence/sprint45/billing/cloudflare-r2-cost-check.txt"
      }
    ]
  },
  "run": {
    "run_date": "2026-08-18",
    "reproduction_steps": [
      "Document exact environment bootstrap command and versioned inputs.",
      "Execute control-specific positive and negative test paths.",
      "Capture command outputs and generated reports in immutable evidence paths."
    ],
    "toolchain": [
      "OWASP ZAP baseline (where applicable)",
      "Manual abuse-case scripts",
      "Repository-local validation commands"
    ]
  },
  "participants": {
    "implementer": "@implementer-handle",
    "independent_reviewer": "@reviewer-handle"
  },
  "artifacts": [
    {
      "kind": "command-output",
      "location": "raw-evidence/sprint45/cloud-iam/command-log.txt",
      "sha256": "sha256:0000000000000000000000000000000000000000000000000000000000000000"
    }
  ],
  "result": {
    "status": "PASS",
    "reviewed_at": "2026-08-18T00:00:00Z",
    "summary": "Least-privilege role constraints and deny paths validated in hosted free-tier rehearsal."
  },
  "remediation": {
    "required": false,
    "owner": "@implementer-handle",
    "due_date": "2026-08-25",
    "tracking_ref": "N/A"
  }
}
