{
  "schema_version": 1,
  "evidence_id": "E-S45-production-secrets-management-20260818",
  "recorded_at": "2026-08-18T05:34:00Z",
  "issue_ref": "https://github.com/nelsonbridge/project-enki/issues/137",
  "architecture_lock_ref": "releases/enki-hosted-1.0-rc2/architecture-lock.json",
  "control_id": "production-secrets-management",
  "validation_scope": {
    "classification": "production-equivalent-hosted-free-tier",
    "external_services_budget_usd": 0,
    "uses_real_customer_data": false,
    "allows_secret_plaintext_in_artifacts": false
  },
  "cost_attestation": {
    "currency": "USD",
    "total_observed_cost_usd": 0,
    "provider_checks": [
      {
        "provider": "Cloudflare",
        "service": "Workers",
        "plan_tier": "free-tier",
        "observed_cost_usd": 0,
        "evidence_location": "raw-evidence/sprint45/billing/preflight-zero-cost-declaration.log"
      },
      {
        "provider": "Neon",
        "service": "Postgres",
        "plan_tier": "free-tier",
        "observed_cost_usd": 0,
        "evidence_location": "raw-evidence/sprint45/billing/preflight-zero-cost-declaration.log"
      }
    ]
  },
  "run": {
    "run_date": "2026-08-18",
    "reproduction_steps": [
      "Verify no-secret-plaintext controls across gate, limitations, checklist, and protocol.",
      "Document hosted secret rotation/revocation prerequisites for independent execution.",
      "Capture immutable rehearsal log and hash."
    ],
    "toolchain": [
      "PowerShell Get-FileHash",
      "Repository-local governance rehearsal"
    ]
  },
  "participants": {
    "implementer": "@copilot-cli",
    "independent_reviewer": "PENDING-INDEPENDENT-REVIEWER"
  },
  "artifacts": [
    {
      "kind": "manual-test-log",
      "location": "raw-evidence/sprint45/secrets-management-rehearsal.log",
      "sha256": "sha256:91a101acfd073f733d5330914f1b55508fd277cbde19078d74bfa1c687351986"
    }
  ],
  "result": {
    "status": "PARTIAL",
    "reviewed_at": "2026-08-18T05:34:00Z",
    "summary": "Secret-handling policy and evidence safety controls are complete; hosted secret lifecycle execution requires external bindings and reviewer action."
  },
  "remediation": {
    "required": true,
    "owner": "HUMAN-SECRETS-OWNER",
    "due_date": "2026-08-25",
    "tracking_ref": "Issue-137/secrets-lifecycle-hosted-rehearsal"
  }
}
